{
    "id":"60e9b025-2222-4a54-b21a-ccc95f79a421",
    "path": [
        {
            "starts": [
                217.0,
                -4696.0
            ],
            "ends": [
                217.0,
                -4695.0
            ],
            "time": 3,
            "movement": [
                0,
                1
            ]
        },
        {
            "starts": [
                217.0,
                -4688.0
            ],
            "ends": [
                215.0,
                -4673.0
            ],
            "time": 1,
            "movement": [
                -1,
                1
            ]
        },
        {
            "starts": [
                215.0,
                -4666.0
            ],
            "ends": [
                215.0,
                -4659.0
            ],
            "time": 1,
            "movement": [
                0,
                1
            ]
        },
        {
            "starts": [
                215.0,
                -4644.0
            ],
            "ends": [
                214.0,
                -4519.0
            ],
            "time": 16,
            "movement": [
                -1,
                1
            ]
        },
        {
            "starts": [
                209.0,
                -4512.0
            ],
            "ends": [
                185.0,
                -4510.0
            ],
            "time": 2,
            "movement": [
                -1,
                0
            ]
        },
        {
            "starts": [
                177.0,
                -4510.0
            ],
            "ends": [
                151.0,
                -4510.0
            ],
            "time": 4,
            "movement": [
                -1,
                0
            ]
        }
    ],
    "time": 37,
    "updated": 1679639333
}