{
    "id":"be4c90bc-f1d2-45a0-9816-edf7ae1ccfe1",
    "path": [
        {
            "starts": [
                20.0,
                3768.0
            ],
            "ends": [
                21.0,
                3768.0
            ],
            "time": 3,
            "movement": [
                1,
                0
            ]
        },
        {
            "starts": [
                27.0,
                3768.0
            ],
            "ends": [
                45.0,
                3762.0
            ],
            "time": 2,
            "movement": [
                1,
                -1
            ]
        },
        {
            "starts": [
                44.0,
                3754.0
            ],
            "ends": [
                44.0,
                3746.0
            ],
            "time": 1,
            "movement": [
                0,
                -1
            ]
        },
        {
            "starts": [
                44.0,
                3475.0
            ],
            "ends": [
                44.0,
                3475.0
            ],
            "time": 1,
            "movement": [
                0,
                0
            ]
        }
    ],
    "time": 50,
    "updated": 1679637836
}