{
    "id":"2d3cfaa9-733d-42a9-b558-2e49678a5d79",
    "path": [
        {
            "starts": [
                149.0,
                -4512.0
            ],
            "ends": [
                154.0,
                -4512.0
            ],
            "time": 3,
            "movement": [
                1,
                0
            ]
        },
        {
            "starts": [
                168.0,
                -4512.0
            ],
            "ends": [
                213.0,
                -4522.0
            ],
            "time": 6,
            "movement": [
                1,
                -1
            ]
        },
        {
            "starts": [
                213.0,
                -4530.0
            ],
            "ends": [
                213.0,
                -4538.0
            ],
            "time": 1,
            "movement": [
                0,
                -1
            ]
        },
        {
            "starts": [
                213.0,
                -4554.0
            ],
            "ends": [
                211.0,
                -4682.0
            ],
            "time": 16,
            "movement": [
                -1,
                -1
            ]
        },
        {
            "starts": [
                211.0,
                -4694.0
            ],
            "ends": [
                211.0,
                -4694.0
            ],
            "time": 1,
            "movement": [
                0,
                0
            ]
        }
    ],
    "time": 39,
    "updated": 1679639388
}