{
    "id":"4c7e0503-0762-41f1-8514-7003c8a288b1",
    "path": [
        {
            "starts": [
                44.0,
                3002.0
            ],
            "ends": [
                44.0,
                3001.0
            ],
            "time": 4,
            "movement": [
                0,
                -1
            ]
        },
        {
            "starts": [
                44.0,
                2993.0
            ],
            "ends": [
                43.0,
                2818.0
            ],
            "time": 21,
            "movement": [
                -1,
                -1
            ]
        },
        {
            "starts": [
                38.0,
                2810.0
            ],
            "ends": [
                15.0,
                2807.0
            ],
            "time": 2,
            "movement": [
                -1,
                0
            ]
        },
        {
            "starts": [
                7.0,
                2807.0
            ],
            "ends": [
                -17.0,
                2804.0
            ],
            "time": 2,
            "movement": [
                -1,
                -1
            ]
        },
        {
            "starts": [
                -23.0,
                2797.0
            ],
            "ends": [
                -24.0,
                2773.0
            ],
            "time": 2,
            "movement": [
                0,
                -1
            ]
        },
        {
            "starts": [
                -24.0,
                2765.0
            ],
            "ends": [
                -24.0,
                2328.0
            ],
            "time": 58,
            "movement": [
                0,
                0
            ]
        }
    ],
    "time": 100,
    "updated": 1679638036
}