{
    "id":"01024b34-2c2c-4ae7-92bc-822553589e10",
    "path": [
        {
            "starts": [
                -97.0,
                4139.0
            ],
            "ends": [
                -97.0,
                4136.0
            ],
            "time": 3,
            "movement": [
                0,
                -1
            ]
        },
        {
            "starts": [
                -97.0,
                4130.0
            ],
            "ends": [
                -95.0,
                3775.0
            ],
            "time": 44,
            "movement": [
                1,
                -1
            ]
        },
        {
            "starts": [
                -81.0,
                3768.0
            ],
            "ends": [
                -73.0,
                3768.0
            ],
            "time": 1,
            "movement": [
                1,
                0
            ]
        },
        {
            "starts": [
                20.0,
                3768.0
            ],
            "ends": [
                20.0,
                3768.0
            ],
            "time": 1,
            "movement": [
                0,
                0
            ]
        }
    ],
    "time": 71,
    "updated": 1679637778
}