{
    "id":"033ed53e-b78c-4473-9cfc-23012d864e10",
    "path": [
        {
            "starts": [
                296.0,
                -2354.0
            ],
            "ends": [
                291.0,
                -2354.0
            ],
            "time": 3,
            "movement": [
                -1,
                0
            ]
        },
        {
            "starts": [
                275.0,
                -2354.0
            ],
            "ends": [
                -85.0,
                -2355.0
            ],
            "time": 45,
            "movement": [
                -1,
                -1
            ]
        },
        {
            "starts": [
                -90.0,
                -2362.0
            ],
            "ends": [
                -92.0,
                -2378.0
            ],
            "time": 2,
            "movement": [
                0,
                -1
            ]
        },
        {
            "starts": [
                -94.0,
                -3566.0
            ],
            "ends": [
                -94.0,
                -3566.0
            ],
            "time": 1,
            "movement": [
                0,
                0
            ]
        }
    ],
    "time": 207,
    "updated": 1679639002
}