{
    "id":"e9a45a6a-17a2-46b5-9f08-86e613620343",
    "path": [
        {
            "starts": [
                -24.0,
                2328.0
            ],
            "ends": [
                -24.0,
                2327.0
            ],
            "time": 2,
            "movement": [
                0,
                -1
            ]
        },
        {
            "starts": [
                -24.0,
                1942.0
            ],
            "ends": [
                -24.0,
                1942.0
            ],
            "time": 1,
            "movement": [
                0,
                0
            ]
        }
    ],
    "time": 56,
    "updated": 1679638100
}