{
    "id":"865b96aa-4810-47dc-8dd2-16995ae37cbb",
    "path": [
        {
            "starts": [
                -24.0,
                1942.0
            ],
            "ends": [
                -24.0,
                1938.0
            ],
            "time": 2,
            "movement": [
                0,
                -1
            ]
        },
        {
            "starts": [
                -24.0,
                1930.0
            ],
            "ends": [
                -26.0,
                1827.0
            ],
            "time": 12,
            "movement": [
                -1,
                -1
            ]
        },
        {
            "starts": [
                -28.0,
                1819.0
            ],
            "ends": [
                -66.0,
                1610.0
            ],
            "time": 26,
            "movement": [
                0,
                -1
            ]
        },
        {
            "starts": [
                -66.0,
                1602.0
            ],
            "ends": [
                -67.0,
                1522.0
            ],
            "time": 10,
            "movement": [
                -1,
                -1
            ]
        },
        {
            "starts": [
                -75.0,
                1518.0
            ],
            "ends": [
                -93.0,
                1481.0
            ],
            "time": 5,
            "movement": [
                0,
                -1
            ]
        },
        {
            "starts": [
                -93.0,
                1473.0
            ],
            "ends": [
                -87.0,
                1039.0
            ],
            "time": 54,
            "movement": [
                1,
                -1
            ]
        },
        {
            "starts": [
                -79.0,
                1039.0
            ],
            "ends": [
                -66.0,
                1028.0
            ],
            "time": 2,
            "movement": [
                0,
                -1
            ]
        },
        {
            "starts": [
                -66.0,
                1020.0
            ],
            "ends": [
                -67.0,
                948.0
            ],
            "time": 8,
            "movement": [
                -1,
                -1
            ]
        },
        {
            "starts": [
                -67.0,
                948.0
            ],
            "ends": [
                -67.0,
                948.0
            ],
            "time": 1,
            "movement": [
                0,
                0
            ]
        }
    ],
    "time": 137,
    "updated": 1679638245
}