{
    "id":"5b9f5b40-6f29-4621-ab4b-4d27b4286e72",
    "path": [
        {
            "starts": [
                44.0,
                3475.0
            ],
            "ends": [
                44.0,
                3473.0
            ],
            "time": 3,
            "movement": [
                0,
                -1
            ]
        },
        {
            "starts": [
                44.0,
                3001.0
            ],
            "ends": [
                44.0,
                3001.0
            ],
            "time": 1,
            "movement": [
                0,
                0
            ]
        }
    ],
    "time": 69,
    "updated": 1679637908
}