{
    "id":"5715d1f1-886c-4da9-b94a-f493d75b9e03",
    "path": [
        {
            "starts": [
                245.0,
                19.0
            ],
            "ends": [
                245.0,
                18.0
            ],
            "time": 3,
            "movement": [
                0,
                -1
            ]
        },
        {
            "starts": [
                245.0,
                17.0
            ],
            "ends": [
                246.0,
                -149.0
            ],
            "time": 20,
            "movement": [
                1,
                -1
            ]
        },
        {
            "starts": [
                246.0,
                -157.0
            ],
            "ends": [
                246.0,
                -165.0
            ],
            "time": 1,
            "movement": [
                0,
                -1
            ]
        },
        {
            "starts": [
                246.0,
                -181.0
            ],
            "ends": [
                236.0,
                -428.0
            ],
            "time": 32,
            "movement": [
                -1,
                -1
            ]
        },
        {
            "starts": [
                235.0,
                -435.0
            ],
            "ends": [
                235.0,
                -443.0
            ],
            "time": 1,
            "movement": [
                0,
                -1
            ]
        },
        {
            "starts": [
                235.0,
                -451.0
            ],
            "ends": [
                237.0,
                -657.0
            ],
            "time": 25,
            "movement": [
                1,
                -1
            ]
        },
        {
            "starts": [
                245.0,
                -657.0
            ],
            "ends": [
                253.0,
                -655.0
            ],
            "time": 1,
            "movement": [
                1,
                1
            ]
        },
        {
            "starts": [
                269.0,
                -657.0
            ],
            "ends": [
                277.0,
                -657.0
            ],
            "time": 1,
            "movement": [
                1,
                0
            ]
        },
        {
            "starts": [
                285.0,
                -657.0
            ],
            "ends": [
                429.0,
                -658.0
            ],
            "time": 18,
            "movement": [
                1,
                -1
            ]
        },
        {
            "starts": [
                429.0,
                -674.0
            ],
            "ends": [
                429.0,
                -682.0
            ],
            "time": 1,
            "movement": [
                0,
                -1
            ]
        },
        {
            "starts": [
                429.0,
                -690.0
            ],
            "ends": [
                431.0,
                -858.0
            ],
            "time": 20,
            "movement": [
                1,
                -1
            ]
        },
        {
            "starts": [
                429.0,
                -866.0
            ],
            "ends": [
                429.0,
                -874.0
            ],
            "time": 1,
            "movement": [
                0,
                -1
            ]
        },
        {
            "starts": [
                429.0,
                -890.0
            ],
            "ends": [
                433.0,
                -1250.0
            ],
            "time": 45,
            "movement": [
                1,
                -1
            ]
        },
        {
            "starts": [
                433.0,
                -1255.0
            ],
            "ends": [
                433.0,
                -1255.0
            ],
            "time": 1,
            "movement": [
                0,
                0
            ]
        }
    ],
    "time": 193,
    "updated": 1679638626
}