{
    "id":"b8f24a06-3002-4297-b1f4-42a6f6bac41c",
    "path": [
        {
            "starts": [
                -67.0,
                948.0
            ],
            "ends": [
                -57.0,
                918.0
            ],
            "time": 5,
            "movement": [
                1,
                -1
            ]
        },
        {
            "starts": [
                -49.0,
                910.0
            ],
            "ends": [
                -19.0,
                863.0
            ],
            "time": 6,
            "movement": [
                0,
                -1
            ]
        },
        {
            "starts": [
                -19.0,
                847.0
            ],
            "ends": [
                -17.0,
                775.0
            ],
            "time": 8,
            "movement": [
                1,
                -1
            ]
        },
        {
            "starts": [
                -16.0,
                767.0
            ],
            "ends": [
                -16.0,
                759.0
            ],
            "time": 1,
            "movement": [
                0,
                -1
            ]
        },
        {
            "starts": [
                -8.0,
                756.0
            ],
            "ends": [
                8.0,
                756.0
            ],
            "time": 1,
            "movement": [
                1,
                0
            ]
        },
        {
            "starts": [
                16.0,
                756.0
            ],
            "ends": [
                136.0,
                754.0
            ],
            "time": 15,
            "movement": [
                1,
                -1
            ]
        },
        {
            "starts": [
                152.0,
                752.0
            ],
            "ends": [
                160.0,
                752.0
            ],
            "time": 1,
            "movement": [
                1,
                0
            ]
        },
        {
            "starts": [
                168.0,
                752.0
            ],
            "ends": [
                185.0,
                745.0
            ],
            "time": 2,
            "movement": [
                1,
                -1
            ]
        },
        {
            "starts": [
                185.0,
                737.0
            ],
            "ends": [
                185.0,
                721.0
            ],
            "time": 1,
            "movement": [
                0,
                -1
            ]
        },
        {
            "starts": [
                185.0,
                713.0
            ],
            "ends": [
                189.0,
                458.0
            ],
            "time": 32,
            "movement": [
                1,
                -1
            ]
        },
        {
            "starts": [
                205.0,
                458.0
            ],
            "ends": [
                220.0,
                461.0
            ],
            "time": 1,
            "movement": [
                1,
                1
            ]
        },
        {
            "starts": [
                236.0,
                466.0
            ],
            "ends": [
                244.0,
                466.0
            ],
            "time": 1,
            "movement": [
                1,
                0
            ]
        },
        {
            "starts": [
                256.0,
                461.0
            ],
            "ends": [
                256.0,
                453.0
            ],
            "time": 1,
            "movement": [
                0,
                -1
            ]
        },
        {
            "starts": [
                258.0,
                445.0
            ],
            "ends": [
                256.0,
                429.0
            ],
            "time": 1,
            "movement": [
                -1,
                -1
            ]
        },
        {
            "starts": [
                256.0,
                421.0
            ],
            "ends": [
                256.0,
                413.0
            ],
            "time": 1,
            "movement": [
                0,
                -1
            ]
        },
        {
            "starts": [
                256.0,
                397.0
            ],
            "ends": [
                253.0,
                311.0
            ],
            "time": 11,
            "movement": [
                -1,
                -1
            ]
        },
        {
            "starts": [
                245.0,
                311.0
            ],
            "ends": [
                243.0,
                289.0
            ],
            "time": 2,
            "movement": [
                0,
                -1
            ]
        },
        {
            "starts": [
                243.0,
                281.0
            ],
            "ends": [
                245.0,
                249.0
            ],
            "time": 4,
            "movement": [
                1,
                -1
            ]
        },
        {
            "starts": [
                247.0,
                233.0
            ],
            "ends": [
                247.0,
                225.0
            ],
            "time": 1,
            "movement": [
                0,
                -1
            ]
        },
        {
            "starts": [
                247.0,
                217.0
            ],
            "ends": [
                245.0,
                25.0
            ],
            "time": 24,
            "movement": [
                -1,
                -1
            ]
        },
        {
            "starts": [
                245.0,
                20.0
            ],
            "ends": [
                245.0,
                20.0
            ],
            "time": 2,
            "movement": [
                0,
                0
            ]
        }
    ],
    "time": 157,
    "updated": 1679638405
}