{
    "id":"58ff2980-c62c-4d7e-8487-cc7438baff11",
    "path": [
        {
            "starts": [
                433.0,
                -1255.0
            ],
            "ends": [
                433.0,
                -1256.0
            ],
            "time": 3,
            "movement": [
                0,
                -1
            ]
        },
        {
            "starts": [
                433.0,
                -1259.0
            ],
            "ends": [
                429.0,
                -1273.0
            ],
            "time": 1,
            "movement": [
                -1,
                -1
            ]
        },
        {
            "starts": [
                429.0,
                -1289.0
            ],
            "ends": [
                429.0,
                -1297.0
            ],
            "time": 1,
            "movement": [
                0,
                -1
            ]
        },
        {
            "starts": [
                429.0,
                -1313.0
            ],
            "ends": [
                430.0,
                -1353.0
            ],
            "time": 4,
            "movement": [
                1,
                -1
            ]
        },
        {
            "starts": [
                430.0,
                -1361.0
            ],
            "ends": [
                430.0,
                -1377.0
            ],
            "time": 1,
            "movement": [
                0,
                -1
            ]
        },
        {
            "starts": [
                430.0,
                -1393.0
            ],
            "ends": [
                428.0,
                -1625.0
            ],
            "time": 28,
            "movement": [
                -1,
                -1
            ]
        },
        {
            "starts": [
                428.0,
                -1633.0
            ],
            "ends": [
                428.0,
                -1641.0
            ],
            "time": 1,
            "movement": [
                0,
                -1
            ]
        },
        {
            "starts": [
                425.0,
                -1657.0
            ],
            "ends": [
                423.0,
                -1673.0
            ],
            "time": 2,
            "movement": [
                -1,
                -1
            ]
        },
        {
            "starts": [
                423.0,
                -1681.0
            ],
            "ends": [
                423.0,
                -1697.0
            ],
            "time": 1,
            "movement": [
                0,
                -1
            ]
        },
        {
            "starts": [
                423.0,
                -1705.0
            ],
            "ends": [
                422.0,
                -2345.0
            ],
            "time": 80,
            "movement": [
                -1,
                -1
            ]
        },
        {
            "starts": [
                410.0,
                -2355.0
            ],
            "ends": [
                394.0,
                -2356.0
            ],
            "time": 2,
            "movement": [
                -1,
                0
            ]
        },
        {
            "starts": [
                378.0,
                -2356.0
            ],
            "ends": [
                362.0,
                -2354.0
            ],
            "time": 2,
            "movement": [
                -1,
                1
            ]
        },
        {
            "starts": [
                354.0,
                -2354.0
            ],
            "ends": [
                338.0,
                -2354.0
            ],
            "time": 1,
            "movement": [
                -1,
                0
            ]
        },
        {
            "starts": [
                330.0,
                -2354.0
            ],
            "ends": [
                296.0,
                -2354.0
            ],
            "time": 7,
            "movement": [
                0,
                0
            ]
        }
    ],
    "time": 161,
    "updated": 1679638791
}